id,name,new_name,brand,ingredientss
0,GENIUS Liquid Collagen
1,GENIUS Sleeping Collagen
2,GENIUS Ultimate Anti-Aging Cream
3,Complete Eye Renewal Balm
4,SUBLIME DEFENSE Ultra Lightweight UV Defense Fluid SPF 50
5,GENIUS Ultimate Anti-Aging Eye Cream
6,GENIUS Ultimate Anti-Aging Vitamin C+ Serum
7,Regenerative Anti-Aging Moisturizer
8,Overnight Restorative Cream
9,POWER Recharging Night Pressed Serum
10,GENIUS Ultimate Anti-Aging Melting Cleanser
11,POWER Advanced Wrinkle Fighter 360° Eye Serum
12,ELEVATE Advanced Retinol Serum
13,GENIUS Collagen Calming Relief
14,Advanced Anti-Aging Repairing Oil
15,POWER Advanced Wrinkle Fighter Moisturizer
16,GENIUS Ultimate Anti-Aging Foaming Cleanser
17,AA (Alguronic Acid) Barrier Serum
18,ELEVATE Advanced Lift Contouring Cream
19,Concentrated Reconstructing Serum
20,Gentle Rejuvenating Cleanser
21,Hydrating Essence Toner
22,Splash Hydrating Setting Mist
23,Pore Corrector Anti-Aging Primer
24,ELEVATE Firming & Lifting Contouring Eye Cream
25,ALIVE Prebiotic Balancing Moisturizer SPF 15
26,SPLASH Absolute Hydration Replenishing Gel Moisturizer
27,Liquid Gold Exfoliating Treatment
28,Vitamin B Serum
29,Balancing Cleanser
30,Vitamin A Serum
31,Instant Facial
32,Liquid Gold Firming Eye Cream
33,Essential Hydration Cream
34,Triple Action Cleanser
35,Balancing Moisturizer & Gentle Exfoliant
36,PlantGenius® Melt Moisturizer with Bakuchiol
37,PlantGenius® Brightening Survival Serum
38,PlantGenius® Creamy Bubbling Cleanser with Fruit Enzymes & AHAs
39,PlantGenius® Line-Filling Eye Balm with Bakuchiol
40,Treatment Cleansing Foam
41,Vintage Single Extract Essence
42,MOISTURE BOUND Rejuvenating Crème
43,MOISTURE BOUND Rejuvenating Eye Treatment Gel
44,Treatment Toner 
45,MOISTURE BOUND Refreshing Hydra-Gel Oil-Free
46,The Essential Creme Fluid
47,MOISTURE BOUND Rejuvenating Serum
48,TIME RESPONSE Eye Reserve Crème
49,TIME RESPONSE Skin Reserve Crème
50,Intensive Vitalizing Eye Essence
51,Youth Revolution Vitamin C Radiance Concentrator
52,Treatment Cleansing Oil Face & Eyes
53,Moisture Bound Skin Energy Hydration Mist
54,Botanical Radiance Oil
55,TIME RESPONSE Skin Reserve Serum
56,Hydrating Oil
57,Astringent Toner Pads
58,High Performance Vitamin C Facial Serum
59,Glycolic Exfoliating & Resurfacing Wipes
60,Oil Free Facial Lotion
61,High Performance Continuous Moisture Eye Cream
62,Day Cream Broad Spectrum Sunscreen SPF 30
63,Pomelo Paradis Body Lotion
64,Orange Sanguine Moisturizing Body Lotion
65,Rose Anonyme Moisturizing Body Lotion 
66,The Quench Quadralipid Rapid Recovery Facial Moisturizer
67,The Quench Eye Reviving Quadralipid Eye Balm
68,The Balance pH Balancing Gel Cleanser
69,The Radiance Brightening Vitamin E + Rosehip Seed Facial Oil
70,The Nightly Retinol + Peptide Anti-Aging Serum
71,R45 The Lift 3-Phase Advanced Neck Contouring Treatment
72,The Ultimate Hydrating Vitamin C Facial Moisturizer
73,The ZenBubble Gel Cream
74,The Daily Vitamin C Day Serum with Antioxidant Complex
75,Skin Love Glow Elixir
76,The True Cream Moisturizing Bomb
77,The True Cream Aqua Bomb
78,Moisturizing Eye Bomb
79,Aqua Bomb Sleeping Mask
80,Peat Miracle Revital Eye Cream
81,Peat Miracle Revital Cream
82,Aqua Bomb Jelly Cleanser
83,Aqua Bomb Hydrating Toner
84,Witch Hazel Herbal Extract Toner
85,The True Cream Moisturizing Bomb Deco
86,Hungarian Water Essence
87,Problem Solution Moisturizer
88,Problem Solution Toner
89,Creamy Cleansing Foam Moist 
90,Peat Miracle Revital Serum Concentrate
91,Problem Solution Cleansing Foam
92,The True Cream Aqua Bomb Deco
93,Youth Creator- Age Knockdown Bomb
94,The True Cream Aqua Bomb Aloe Vera
95,Milky Hydra Balancing Moisturizer 
96,Cleansing Gel Oil Enriched
97,Pore Cleaner Foam Cleanser
98,Pore Cleaner Moisturizer
99,Aqua Bomb Mist
100,The True Tincture Essence - Chamomile
101,Cleansing Herb Water
102,Squalane + Omega Repair Cream
103,Squalane + 10% Lactic Acid Resurfacing Night Serum
104,Squalane + Marine Algae Eye Cream
105,Squalane + Probiotic Gel Moisturizer
106,Squalane + Peptide Eye Gel
107,Squalane + Phyto-Retinol Serum
108,Squalane + Tea Tree Balancing Oil
109,100% Sugarcane Squalane
110,Squalane + Antioxidant Cleansing Oil
111,Squalane + Zinc Sheer Mineral Sunscreen SPF 30 PA +++
112,Squalane + Tea Tree Cleansing Gel
113,Squalane + Hyaluronic Toning Mist
114,Vitamin Enriched Face Base Priming Moisturizer
115,Extra Eye Repair Cream
116,Hydrating Eye Cream
117,Hydrating Face Cream Moisturizer
118,Soothing Face Cleanser Oil
119,Hydrating Water Fresh Cream Moisturizer
120,Extra Repair Moisturizing Balm SPF 25
121,Extra Repair Moisture Cream
122,Extra Illuminating Moisture Balm
123,Lathering Tube Soap
124,Hydrating Face Tonic Toner
125,Intensive Skin Supplement Serum
126,Clear Complexion Cleanser
127,MakeUp-BreakUp Cool Cleansing Oil
128,Detoxifying Black Charcoal Cleanser
129,Purifying Cleansing Gel
130,Cactus Water Moisturizer
131,Rosewater Mist with Witch Hazel
132,Resurfacing Treatment Toner with Apple Cider
133,Chia Seed Moisture Cream
134,Rosehip Omega Face Oil
135,Peptide Trio Eye Cream
136,Vitamin B12 Hydration Booster Serum
137,Charcoal Spot Corrector
138,Green Tea Oil-Free Moisturizer
139,Briogeo + Kathleen Lights B. Well Aromatic Essential Oils Kit
140,Eau Parfumée Au Thé Blanc Body Lotion
141,Eau Parfumée Au Thé Vert Body Lotion
142,Leila Lou Oil
143,Rosie Oil
144,James Oil
145,Lake Oil
146,Angie Oil
147,Tilly Oil
148,Vinoperfect Anti Dark Spot Serum
149,Vinopure Natural Salicylic Acid Pore Minimizing Serum
150,Vinoperfect Brightening Glycolic Overnight Cream
151,Beauty Elixir
152,Vinopure Natural Salicylic Acid Pore Minimizing Toner
153,Vinosource Moisturizing Sorbet
154,Vinosource SOS Deep Hydration Serum
155,Instant Foaming Cleanser
156,Vinoperfect Brightening Moisturizer with Niacinamide
157,Vinosource SOS Intense Hydration Moisturizer
158,Vinopure Pore Purifying Gel Cleanser
159,Moisturizing Toner
160,Grape Water
161,Resveratrol Lift Night Infusion Cream
162,Vinoperfect Brightening Glycolic Essence
163,Premier Cru Anti-Aging Rich Cream
164,VineActiv Vitamin C Energizing Eye Cream
165,Vine[activ] Overnight Detox Oil
166,Resveratrol Lift Hyaluronic Acid Eye Lifting Balm
167,Micellar Cleansing Water
168,Premier Cru Anti-Aging Cream
169,Premier Cru Anti-Aging Eye Cream
170,Gentle Cleansing Milk
171,Resveratrol Lift Face Lifting Soft Cream
172,VineActiv Vitamin C Anti-Wrinkle Serum
173,Vinopure Natural Oil Control Moisturizer
174,Premier Cru Anti-Aging Serum
175,Make-Up Removing Cleansing Oil
176,Resveratrol Lift Firming Serum
177,Vinosource Overnight Recovery Oil
178,Premier Cru Anti-Aging Precious Oil
179,VineActiv 3 in 1 Vitamin C Anti-Wrinkle Moisturizer
180,Premieres Vendanges Moisturizing Cream
181,Magic Cream Moisturizer
182,Charlotte's Magic Cream Mini
183,Magic Eye Rescue Cream
184,Charlotte's Magic Night Cream
185,Magic Cream Moisturizer - Lunar New Year Limited Edition
186,Multi-Miracle Glow Cleansing Balm
187,Love Story Body Lotion
188,Double Serum Complete Age Control Concentrate
189,Gentle Foaming Cleanser with Cottonseed
190,One-Step Gentle Exfoliating Cleanser with Orange Extract
191,Extra-Firming Wrinkle Control Regenerating Night Cream
192,Super Restorative Total Eye Concentrate
193,Multi-Active Night Cream - Normal to Combination Skin
194,Extra-Firming Wrinkle Control Firming Day Cream SPF 15
195,Toning Lotion with Camomile
196,Hydra-Essentiel Silky Cream - Normal to Dry Skin
197,Super Restorative Night Age Spot Correcting Replenishing Cream
198,Multi-Active Day Cream SPF 20 - All Skin Types
199,V Shaping Lift Serum
200,Multi Active Day Cream - All Skin Types
201,Blue Orchid Face Treatment Oil
202,Hydra-Essentiel Rich Cream - Very Dry Skin
203,Extra-Comfort Toning Lotion
204,Gentle Foaming Cleanser-Combination or Oily Skin 
205,Extra-Firming Eye
206,Multi-Active Eye
207,Hydra-Essentiel Bi-Phase Serum
208,Santal Face Treatment Oil
209,Cleansing Milk with Alpine Herbs
210,Lotus Face Treatment Oil
211,Beauty Flash Balm
212,Hydra-Essentiel Cooling Gel - Normal to Combination Skin
213,Sunscreen Care Oil Spray Broad Spectrum SPF 30
214,Eye Contour Gel
215,Multi-Active Day Cream-Gel - Normal to Combination Skin
216,Enhancing Eye Lift Serum
217,Extra??Firming Day Cream All Skin Types
218,UV PLUS Anti-Pollution Sunscreen Multi-Protection Tint SPF 50
219,Refreshing Gel Cleanser
220,Radiance Foaming Milk Cleanser
221,Skin Renewing Peel Treatment Glycolic Acid Cleanser
222,Pore & Blemish Acne Cleanser
223,Moisture Surge 72-Hour Auto-Replenishing Hydrator
224,Dramatically Different Moisturizing Lotion+
225,Dramatically Different Moisturizing Gel
226,Liquid Facial Soap
227,Even Better Clinical Radical Dark Spot Corrector + Interrupter
228,Clarifying Lotion 2
229,Take The Day Off Cleansing Balm
230,Clinique iD Custom-Blend Hydrator Collection
231,All About Eyes Rich Eye Cream
232,Acne Solutions Clinical Clearing Gel
233,All About Eyes
234,Moisture Surge Intense Skin Fortifying Hydrator
235,Acne Solutions Cleansing Foam
236,Redness Solutions with Probiotic Technology Daily Relief Cream
237,Clarifying Lotion 3
238,Clinique Smart Custom-Repair Serum
239,Clarifying Lotion 2
240,Rinse-Off Foaming Cleanser
241,Acne Solutions Clarifying Lotion
242,Turnaround Overnight Revitalizing Moisturizer
243,Dramatically Different Hydrating Jelly
244,Pep-Start 2-in-1 Exfoliating Cleanser
245,Clinique iD??  Moisturizer + Concentrate for Pores & Uneven Texture
246,Smart Night Custom-Repair Moisturizer - Dry Combination
247,Superdefense SPF 25 Fatigue + 1st Signs of Age Multi-Correcting Cream
248,Repairwear Laser Focus Wrinkle Correcting Eye Cream
249,Pep-Start Eye Cream
250,Blackhead Solutions Self-heating Blackhead Extractor
251,Smart Night Custom-Repair Moisturizer - Very Dry to Dry
252,Clinique For Men Anti-Age Moisturizer
253,Take The Day Off Cleansing Oil
254,Clinique iD??  Moisturizer + Concentrate for Uneven Skin Tone
255,Clinique iD??  Moisturizer + Concentrate for Lines & Wrinkles
256,Repairwear Anti-Gravity Eye Cream
257,Fresh Pressed Daily Booster with Pure Vitamin C 10%
258,Moisture Surge Eye 96-Hour Hydro-Filler Concentrate
259,Redness Solutions Soothing Cleanser
260,Clinique For Men Maximum Hydrator 72-Hour Auto-Replenishing Hydrator
261,All About Eyes Serum De-Puffing Eye Massage
262,Repairwear Laser Focus 
263,Clinique Smart Clinical MD Multi-Dimensional Age Transformer Revolumize
264,Facial Soap with Dish
265,Repairwear Laser Focus Night Line Smoothing Cream for Very Dry to Dry Combination Skin
266,Broad Spectrum SPF 50 Sunscreen Face Cream
267,Moisture Surge Hydrating Supercharged Concentrate
268,Clinique iD??  Moisturizer + Concentrate for Irritation
269,Acne Solutions Acne + Line Correcting Serum
270,Clinique For Men Anti-Age Eye Cream
271,Clarifying Lotion 3
272,Clinique iD??  Moisturizer + Concentrate for Fatigue
273,Clarifying Lotion 1
274,Repairwear Laser Focus Night Line Smoothing Cream for Combination Oily to Oily Skin
275,Oil Control Mattifying Moisturizer
276,Moisture Surge Face Spray
277,Acne Solutions Cleansing Face and Body Soap
278,Repairwear Uplifting Firming Cream
279,Moisturizing Lotion
280,Dramatically Different Moisturizing Cream
281,Acne Solutions Cleansing Gel
282,Smart Broad Spectrum SPF 15 Custom-Repair Moisturizer for Dry Combination Skin
283,Broad Spectrum SPF 21 Moisturizer
284,Foaming Sonic Facial Soap
285,Superdefense City Block SPF 50+ Daily Energy + Face Protector
286,Clarifying Lotion 4
287,City Block Sheer Oil-Free Daily Face Protector SPF 25
288,Even Better Skin Tone Correcting Lotion Broad Spectrum SPF 20
289,Turnaround Revitalizing Serum
290,Clinique Smart Custom-Repair Eye Treatment
291,Clinique Smart Clinical MD Multi-Dimensional Age Transformer Duo Resculpt + Revolumize
292,Pep-Start HydroBlur Moisturizer
293,Smart Broad Spectrum SPF 15 Custom-Repair Moisturizer for Very Dry to Dry Skin
294,Repairwear Laser Focus Line Smoothing Cream Broad Spectrum SPF 15 for Very Dry to Dry Combination Skin
295,Smart Night Custom-Repair Moisturizer -Combination Oily to Oily
296,Exfoliating Tonic
297,Even Better Eyes Dark Circle Corrector
298,Fresh Pressed Renewing Powder Cleanser with Pure Vitamin C
299,Pore Refining Solutions Stay-Matte Hydrator
300,Fresh Pressed Clinical Daily + Overnight Boosters with Pure Vitamin C 10% + A (Retinol)
301,Clinique For Men Maximum Hydrator Eye 96-Hour Hydro-Filler Concentrate
302,Repairwear Uplifting Firming Cream Broad Spectrum SPF 15
303,Broad Spectrum SPF 50 Mineral Sunscreen Fluid for Face
304,Dramatically Different Hydrating Jelly Mini
305,Fresh Pressed 7-day System with Pure Vitamin C
306,Repairwear Sculpting Night Cream
307,Pore Refining Solutions Correcting Serum
308,Moisture Surge Hydrating Lotion
309,Turnaround Revitalizing Lotion
310,Broad Spectrum SPF 30 Mineral Sunscreen Lotion for Body
311,Clinique For Men Super Energizer Anti-Fatigue Depuffing Eye Gel
312,Pep-Start Daily UV Protector Broad Spectrum SPF 50
313,Even Better Skin Tone Correcting Moisturizer Broad Spectrum SPF 20
314,Repairwear Laser Focus Line Smoothing Cream Broad Spectrum SPF 15 for Combination Oily to Oily Skin
315,Full Spectrum 360° Sun Silk Drops Organic Sunscreen SPF 30
316,Classic Face Sunscreen SPF 50 White Tea
317,Makeup Setting Spray Organic Sunscreen SPF 30
318,Mineral Sun Silk Crème SPF 30
319,Mineral Face Organic Matte Finish Sunscreen Lotion SPF 30
320,ER+ Radical Recovery After-Sun Lotion
321,Daydream Mineral Primer SPF 30
322,Full Spectrum 360°  Mineral Sun Silk Moisturizer Organic Sunscreen SPF 30
323,Mineral Face Organic Matte Tint Sunscreen Lotion SPF 30
324,SPF 30 Booster Drops Broad Spectrum Sunscreen
325,Special Cleansing Gel
326,Biolumin-C Vitamin C Eye Serum
327,Active Moist Moisturizer
328,Dynamic Skin Recovery SPF50 Moisturizer
329,Precleanse Cleansing Oil
330,Ultracalming Cleanser
331,Super Rich Repair Moisturizer
332,Multi-Active Toner 
333,Intensive Moisture Balance Moisturizer
334,BioLumin-C Vitamin C Serum
335,Skin Smoothing Cream Moisturizer
336,Calm Water Gel Moisturizer 
337,Clearing Skin Wash
338,MultiVitamin Power Firm Eye Cream
339,AGE Bright Clearing Serum
340,Invisible Physical Defense Sunscreen SPF 30
341,Ultracalming Serum Concentrate
342,Sound Sleep Cocoon Night Gel-Cream
343,Age Reversal Eye Complex
344,AGE Smart Phyto-Nature Firming Serum
345,AGE Bright Spot Fader
346,Clearing Defense SPF 30 Moisturizer
347,Stress Positive Eye Lift Mask 
348,Breakout Clearing Foaming Wash
349,Prisma Protect SPF 30 Moisturizer
350,Active Clay Prebiotic Cleanser
351,Skin Soothing Hydrating Lotion
352,Intensive Moisture Cleanser
353,Precleanse Balm
354,Breakout Clearing All Over Toner
355,Breakout Clearing Booster
356,Capture Youth Serum Collection
357,Capture Totale Multi-Perfection Creme
358,Capture Youth Glow Booster Age-Delay Illuminating Serum
359,Capture Youth Lift Sculptor Age-Delay Lifting Serum
360,Hydra Life Hydration Rescue Intense Sorbet Creme
361,One Essential Skin Boosting Super Serum
362,Capture Youth Plump Filler Age-Delay Plumping Serum
363,Capture Totale C.E.L.L. ENERGY - Super Potent Age-Defying Intense Serum
364,Capture Youth Age-Delay Advanced Crème
365,Capture Totale Intensive Night Restorative Crème
366,Capture Totale C.E.L.L. ENERGY - Firming & Wrinkle-Correcting Eye Cream
367,Capture Totale C.E.L.L. ENERGY - Firming & Wrinkle-Correcting Crème
368,One Essential Eye Serum
369,Hydra Life Micellar Water No Rinse Cleanser
370,Hydra Life Deep Hydration Sorbet Water Essence
371,Capture Youth Redness Soother Age-Delay Anti-Redness Soothing Serum
372,Diorsnow Brightening Refining Moist Cloud Crème
373,J'adore Body Milk
374,Diorsnow Essence of Light Pure Concentrate of Light Brightening Milk Serum
375,Hydra Life Balancing Hydration 2 in 1 Sorbet Water
376,Capture Totale C.E.L.L. ENERGY High-Performance Gentle Cleanser
377,Capture Totale C.E.L.L. ENERGY - High-Performance Treatment Serum-Lotion
378,Hydra Life Cooling Hydration Sorbet Eye Gel
379,Hydra Life Micellar Milk No Rinse Cleanser
380,Hydra Life Lotion To Foam Fresh Cleanser
381,Hydra Life Oil To Milk Makeup Removing Cleanser
382,Capture Youth Matte Maximizer Age-Delay Mattifying Serum
383,Capture Totale Multi-Perfection Creme Refill
384,Hydra Life Fresh Hydration Sorbet Crème
385,Light Blue Cream
386,The One Body Lotion
387,Cashmere Mist Body Lotion
388,Cashmere Mist Body Creme 
389,No Worries Hydrating Face Moisturizer
390,Down Under Collagen Boosting Eye Treatment
391,Perky Collagen Boosting Serum
392,True Blue Hydrating Serum
393,Noosa Nourishing Crème Cleanser
394,Stoked Weightless Face Moisturizer
395,Kibosh Weightless Foaming Cleanser
396,Surf Chaser Reverse Aging Serum
397,Tassie Anti-Pollution Serum
398,Bondi Hydrating Mist
399,Ningaloo Copper Peptide Firming Serum
400,Lifesaver Skin Brightening Toner
401,Hyaluronic Serum
402,Glow Drops
403,Super Anti-Aging Serum
404,Face Cream
405,Enzyme Cleanser
406,Eye Cream
407,Face Cream Rich
408,Cleanser
409,Anti-Pollution Drops
410,Calming Serum
411,Night Serum
412,Sun Drops SPF 50
413,Darker Skin Tones Hyaluronic Serum
414,Clarifying Face Cream
415,Balancing Toner
416,Clarifying Spot Treatment
417,Face Cream Light
418,Clarifying Acne Spot Treatment
419,Lifting Serum
420,Brightening Serum
421,Clarifying Serum
422,Darker Skin Tones Enzyme Cleanser
423,Brightening Face Cream
424,Darker Skin Tones Face Cream
425,Hydrating Face Mist
426,Brightening Face Lotion
427,Hyaluronic Ampoules
428,Darker Skin Tones Face Cream Rich
429,Darker Skin Tones Foam Cleanser
430,needles no more® NO MORE BAGGAGE eye de-puffing gel
431,Dark Spots No More® Triple Acid Spot Minimizing Concentrate
432,Needles No More Wrinkle Smoothing Cream
433,Do Not Age with Dr. Brandt Triple Peptide Eye Cream
434,Hyaluronic Facial Cream
435,Do Not Age with Dr. Brandt Time Defying Cream
436,2% Retinol Complex Serum
437,pores no more® Pore Purifying Cleanser
438,24/7 Retinol Eye Cream
439,Do Not Age with Dr. Brandt Transforming Pearl Serum
440,Clean Biotic pH-balanced yogurt cleanser with chlorophyll
441,pores no more® Mattifying Hydrator Pore Minimizing Gel
442,Bright Biotic Dark Spot Minimizing Serum
443,Alpha Beta® Pore Perfecting Cleansing Gel
444,Vitamin C+ Collagen Deep Cream
445,Ferulic Acid + Retinol Brightening Solution
446,Alpha Beta® Pore Perfecting & Refining Serum
447,Ferulic + Retinol Triple Correction Eye Serum
448,C+ Collagen Brighten & Firm Vitamin C Serum
449,Ferulic + Retinol Anti-Aging Moisturizer
450,Hyaluronic Marine Oil-Free Moisture Cushion
451,Stress Repair Face Cream with Niacinamide
452,Ferulic + Retinol Wrinkle Recovery Overnight Serum
453,Stress Rescue Super Serum with Niacinamide
454,Alpha Beta® Exfoliating Moisturizer
455,Hyaluronic Marine Hydration Booster
456,Clinical Grade IPL Dark Spot Correcting Serum
457,Stress SOS Eye Cream with Niacinamide
458,Ferulic + Retinol Eye Cream
459,Dark Spot Sun Defense Broad Spectrum SPF 50
460,All-In-One Cleanser With Toner
461,Hyaluronic Marine Dew It Right Eye Gel
462,Vitamin C+ Collagen Brighten & Firm Eye Cream
463,C + Collagen Perfect Skin Set & Refresh Mist
464,Instant Radiance Sun Defense Sunscreen Broad Spectrum SPF 40
465,Sheer Mineral Sun Spray SPF 50
466,Clinical Concentrate Radiance Booster 
467,Color Smart Cleanser & Mask
468,Ceramidin Cream
469,Cicapair Tiger Grass Cream
470,Cicapair Tiger Grass Serum
471,Focuspot Micro Tip Patches
472,Ceramidin Liquid
473,Cicapair Tiger Grass Camo Drops SPF 44
474,Cicapair Tiger Grass Calming Gel Cream
475,Focuspot Blemish Micro Tip Patch
476,Teatreement Moisturizer
477,V7 Priming Moisturizer
478,Peptidin Radiance Serum with Energy Peptides
479,Focuspot Dark Spot Micro Tip Patch
480,Focuspot Line & Wrinkle Micro Tip Patch
481,Dermaclear Micro Foam
482,Cicapair Tiger Grass Calming Mist
483,Dermaclear Micro Water
484,Teatreement Cleansing Foam
485,Peptidin Firming Serum with Energy Peptides
486,V7 Antioxidant Serum
487,Teatreement Toner
488,Focuspot Dark Circle Micro Tip Patch
489,Every Sun Day Sun Fluid SPF 50+
490,Every Sun Day Mineral Sunscreen SPF 50+
491,Protini Polypeptide Moisturizer
492,C-Firma Vitamin C Day Serum
493,T.L.C. Framboos Glycolic Resurfacing Night Serum
494,Lala Retro Whipped Moisturizer with Ceramides
495,B-Hydra Intensive Hydration Serum
496,A-Passioni Retinol Cream
497,Virgin Marula Antioxidant Face Oil
498,Beste No. 9 Jelly Cleanser
499,C-Tango Multivitamin Eye Cream
500,D-Bronzi Anti-Pollution Sunshine Drops
501,Virgin Marula Antioxidant Face Oil Mini
502,Shaba Complex Firming Eye Serum
503,Slaai  Makeup-Melting Butter Cleanser
504,Umbra Sheer Physical Daily Defense Broad Spectrum Sunscreen SPF 30
505,Umbra Tinte Physical Daily Defense Broad Spectrum Sunscreen SPF 30
506,JuJu Exfoliating Bar
507,Pekee Cleansing Bar
508,No. 3 Exotic Goddess Ageless Serum
509,No. 4 Vanilla Silk Hydrating Lotion
510,Deep Sea Collagen Elixir Serum Plump and Refine
511,Turmeric Beauty Latte Serum Clear and Brighten
512,Probiotic Radiance Tonic  Serum Calm and Restore
513,Coco Bliss Intensive Repair
514,No. 2 Citrus Rhapsody Toner Mist
515,Gold Rush Eye Balm
516,Snowflower Illuminating Face Oil
517,Glowing Skin Smoothie Serum Protect and Smooth
518,No. 1 Belle Frais Cleansing Milk
519,Marvelous CBD Massage and Body Oil
520,Marvelous CBD Massage & Body Oil Rollerball
521,Raven Excellent Body Milk
522,Myth Excellent Body Milk
523,Verb Excellent Body Milk
524,Pseudonym Excellent Body Milk
525,Fable Excellent Body Milk
526,Rrose Excellent Body Milk
527,Double Mousse Gentle Cleansing Foam
528,Solid Cleansing Oil - Coconut Oil Makeup Remover
529,Glow Cream Highlighting Primer
530,Phelityl Night Cream
531,Hydraphel Skin Supplement Lotion
532,Phormula 3-9 Repair Cream
533,Detoxifying Cleansing Oil
534,Pore Refining Detox Double Cleanse
535,Light Controlling Lotion
536,Advanced Night Repair Synchronized Recovery Complex II
537,Advanced Night Repair Eye Supercharged Complex
538,Advanced Night Repair Synchronized Recovery Complex II Duo
539,Revitalizing Supreme Global Anti-Aging Crème
540,Micro Essence Skin Activating Treatment Lotion
541,Perfectionist CP+R Wrinkle Lifting/Firming Serum
542,Resilience Multi-Effect Night Tri-Peptide Face and Neck Creme
543,DayWear Matte Oil-Control Anti-Oxidant Moisture Gel Creme
544,Perfectly Clean Multi-Action Foam Cleanser/Purifying Mask 
545,Advanced Night Repair Intense Reset Concentrate
546,Advanced Night Repair Concentrated Recovery Eye Mask
547,Nutritious Super-Pomegranate Radiant Energy 2-in-1 Cleansing Foam
548,Advanced Night Repair Eye Concentrate Matrix
549,Idealist Pore Minimizing Skin Refinisher
550,NightWear Plus Anti-Oxidant Night Detox Creme
551,Micro Essence Skin Activating Treatment Lotion Mini
552,Perfectionist Pro Rapid Firm + Lift Treatment
553,Revitalizing Supreme+ Night Intensive Restorative Crème
554,Advanced Time Zone Night Age Reversing Line/Wrinkle Crème
555,"DayWear Advanced Multi-Protection Anti-Oxidant Creme, Normal/Combination"
556,Soft Clean Moisture Rich Foaming Cleanser
557,Nutritious Super-Pomegranate Radiant Energy Moisture Crème
558,Perfectionist Pro Instant Wrinkle Filler Tri-Polymer Blend
559,Perfectly Clean Multi-Action Toning Lotion/Refiner 
560,DayWear Eye Cooling Anti-Oxidant Moisture GelCreme
561,Advanced Time Zone Age Reversing Line/Wrinkle Eye Creme
562,Revitalizing Supreme Global Anti-Aging Eye Balm
563,Advanced Time Zone SPF 15- Normal/Combination Skin
564,Advanced Night Micro Cleansing Foam
565,Advanced Night Micro Cleansing Balm
566,Perfectionist Pro Rapid Brightening Treatment with Ferment2 + Vitamin C
567,"DayWear Advanced Multi-Protection Anti-Oxidant Creme, Dry"
568,Cleanser
569,Time Retreat Radiance Boost Treatment
570,WHITE Brightening Cream
571,Time Retreat Radiance Essence
572,Gel Balm Cleanser
573,Age Defying Smoothing Treatment
574,Radiance Antioxidant Eye Cream
575,Moisture Cream
576,Time Retreat Intensive Night Cream
577,Radiance Face Mist
578,Dynaspot
579,Time Retreat Eye Treatment
580,Cleansing Oil Capsules
581,WHITE Advanced Brightening Serum
582,WHITE Brightening Lotion
583,Brumisateur® Natural Mineral Water Facial Spray
584,Brumisateur® Natural Mineral Water Facial Spray Travel Duo
585,Brumisateur® Natural Mineral Water Facial Spray Travel Trio
586,HONEYMOON GLOW AHA Resurfacing Night Serum with Hydrating Honey + Gentle Flower Acids
587,Green Clean Makeup Removing Cleansing Balm
588,Honey Drop Lightweight Moisturizer
589,Green Defense Daily Mineral Sunscreen
590,Clean Bee Ultra Gentle Facial Cleanser
591,Cheer Up Brightening Vitamin C Eye Cream with Acerola Cherry
592,Honey Grail Ultra-Hydrating Face Oil
593,Sleep Tight Firming Night Balm
594,Dew It All Total Eye Cream
595,Honey Savior All-in-One Skin Repair Salve
596,Very Cherry Bright 15% Clean Vitamin C Serum with Acerola Cherry
597,Green Clean Makeup Meltaway Cleansing Balm Limited Edition Jumbo
598,Better Daze Ahead CBD Moisturizer
599,Daily Greens Oil-Free Gel Moisturizer with Moringa and Papaya
600,Rose Gold Elixir ?? 24k Gold Infused Beauty Oil
601,Liquid Powder Oil Balancing Serum
602,Rose Gold Elixir 24K Moisturizing Gel Cream
603,Haldi Eyes Brightening Turmeric Eye Cream
604,Mini Liquid Glass Radiance Serum
605,Volcanic Elixir Polynesian Beauty Oil
606,Ultra Repair® Cream Intense Hydration
607,Pure Skin Face Cleanser
608,Ultra Repair Face Moisturizer
609,Ultra Repair Wild Oat Hydrating Toner
610,Hello FAB Coconut Water Cream
611,Ultra Repair® Hydrating Serum
612,Ultra Repair Hydra-Firm Sleeping Cream
613,Hello FAB Coconut Skin Smoothie Priming Moisturizer
614,Ultra Repair Oil-Control Moisturizer
615,"Eye Duty Triple Remedy: Brighten, Depuff and Smooth"
616,Skin Rescue Deep Cleanser With Red Clay
617,FAB Skin Lab Retinol Eye Cream with Triple Hyaluronic Acid
618,Ultra Repair® Oat & Hemp Seed Dry Oil
619,Weightless Liquid Mineral SPF 30
620,5 in 1 Face Cream SPF 30
621,FAB Skin Lab Retinol Serum 0.25% Pure Concentrate
622,Ultra Repair BarriAIR Cream
623,Skin Rescue Acne Clearing Pads with White Clay
624,5 in 1 Eye Cream
625,Eye Duty Triple Remedy A.M. Gel Cream
