id,name,new_name,brand,ingredientss
1280,A Perfect World Antioxidant Moisturizer with White Tea
1281,Dr. Andrew Weil for Origins Mega-Mushroom Relief & Resilience Soothing Cream
1282,Dr. Andrew Weil For Origins Mega-Bright SPF 30 Skin Tone Correcting Oil-Free Moisturizer
1283,Original Skin Renewal Serum with Willowherb
1284,Plantscription Youth-Renewing Power Night Cream
1285,Mega-Mushroom Skin Relief Micellar Cleanser
1286,Dr. Andrew Weil For Origins Mega-Bright Dark Spot Correcting Serum
1287,A Perfect World Age-Defense Skin Guardian with White Tea
1288,Plantscription Anti-Aging Eye Treatment
1289,Dr. Andrew Weil for Origins Mega-Mushroom Relief & Resilience Hydra Burst Gel Lotion
1290,Dr. Andrew Weil For Origins Mega-Mushroom Relief & Resilience Soothing Treatment Lotion
1291,No Puffery Cooling Roll-On For Puffy Eyes
1292,A Perfect World SPF 20 Age-Defense Eye Cream with White Tea
1293,Modern Friction Cleansing Oil with Radiance-Boosting White & Purple Rice
1294,Dr. Andrew Weil For Origins Mega Defense Barrier-Boosting Essence Oil
1295,Plantscription Powerful Lifting Concentrate
1296,Original Skin Essence Lotion with Dual Ferment Complex
1297,Maskimizer Skin-Optimizing Mask Primer
1298,GinZing Ultra-Hydrating Energy-Boosting Cream Limited Edition
1299,Acne Healing Dots
1300,Microneedling Anti-Wrinkle Retinol Patches
1301,Microneedling Dark Spot Brightening Dots
1302,Pore Treatment Strips
1303,High Potency Classics: Face Finishing & Firming Moisturizer
1304,Vitamin C Ester Photo-Brightening Moisturizer SPF 30
1305,High Potency Classics: Hyaluronic Intensive Moisturizer
1306,Vitamin C Ester Brightening Serum
1307,Hypoallergenic Firming Eye Cream
1308,High Potency Growth Factor Firming & Lifting Serum
1309,Cold Plasma+ Advanced Serum Concentrate
1310,Essential Fx Acyl-Glutathione Eyelid Lift Serum
1311,No:Rinse Intensive Pore Minimizing Toner
1312,High Potency Classics: Face Firming Serum
1313,Essential Fx Acyl-Glutathione Smoothing & Brightening Under-Eye Cream
1314,Vitamin C Ester Brightening Overnight Treatment
1315,Vitamin C Ester Brightening Amine Face Lift
1316,Cold Plasma+ Eye
1317,High Potency Classics: Firming Eye Lift
1318,Essential Fx Acyl-Glutathione Deep Crease Serum
1319,Essential Fx Acyl-Glutathione Rejuvenating Moisturizer
1320,Multi-Action Overnight Intensive Firming Mask
1321,Neuropeptide Smoothing Facial Conformer
1322,Vitamin C Ester Brightening Eye Serum
1323,Essential Fx Acyl-Glutathione Intensive Overnight Moisturizer
1324,No:Rinse Micellar Cleansing Treatment
1325,H2 Elemental Energy Hydrating Cloud Cream
1326,High Potency Classics: Firming Evening Repair
1327,PRE:EMPT SERIES Brightening Eye Cream
1328,Neuropeptide Firming Moisturizer
1329,Neuropeptide Night Cream
1330,No Makeup Easy Rinse Makeup-Removing Cleanser
1331,PRE:EMPT SERIES The Fixer Solid Oil Balm
1332,No:Rinse DMAE Firming Pads
1333,Neuropeptide Firming & Illuminating Under-Eye Cream
1334,High Potency Classics: Face Finishing & Firming Moisturizer Tint SPF 30
1335,Vitamin C Ester Citrus Brightening Cleanser
1336,High Potency Classics: Nutritive Cleanser
1337,PRO Strength Niacinamide Discoloration Treatment
1338,Water Drench Hyaluronic Acid Moisturizer
1339,Vital-E Microbiome Age Defense Eye Cream
1340,24K Gold Pure Luxury Lift & Firm Hydra-Gel Eye Patches
1341,Anti-Aging Cleansing Gel
1342,Max Complexion Correction Pads
1343,Potent-C Vitamin C Power Serum
1344,Water Drench Hyaluronic Cloud Serum
1345,Retinol Fusion PM
1346,Instant FIRMx Eye
1347,Instant Firmx
1348,PRO Strength Retinoid Peptide Serum
1349,Peptide 21 Wrinkle Resist Serum
1350,Peptide 21 Lift & Firm Moisturizer
1351,AHA/BHA Acne Clearing Gel
1352,Acne Clearing Wash
1353,Acne-Clear Invisible Dots
1354,Potent-C Vitamin C Bright & Plump Moisturizer
1355,Max Mineral Naked Broad Spectrum SPF 45
1356,Potent-C Vitamin C Power Eye Cream
1357,PRO Strength Lactic Pore Treatment
1358,3% Glycolic Solutions Cleanser
1359,Vital-E Microbiome Age Defense Cream
1360,Max Sheer All Day Moisture Defense Lotion SPF 30 Sunscreen Lotion
1361,Water Drench Cleanser
1362,Acne-Clear Oil-Free Matte Moisturizer
1363,Retinol Fusion PM Eye Cream
1364,8% Glycolic Solutions Toner
1365,Instant Mineral SPF 45  
1366,10% Glycolic Solutions Moisturizer
1367,Water Drench® Hyaluronic Cloud Hydrating Toner Mist
1368,Green Releaf Therapeutic Sleep Cream
1369,Potent-C Vitamin C Targeted Spot Brightener
1370,Green Releaf Calming Face Oil
1371,Hungarian Thermal Water Mineral-Rich Moisturizer
1372,FIRMx® Collagen Moisturizer
1373,Water Drench® Hyaluronic Cloud Hydrating Eye Gel
1374,Purity Made Simple Cleanser
1375,Renewed Hope in A Jar Facial Moisturizer
1376,The Microdelivery Exfoliating Facial Wash
1377,Renewed Hope in A Jar SPF 30 Moisturizer
1378,Purity Made Simple Ultra-Light Moisturizer
1379,anti-wrinkle miracle worker+ line-correcting moisturizer
1380,Renewed Hope in A Jar Night Moisturizer
1381,Ultimate Miracle Worker Night
1382,Ultimate Miracle Worker Multi-Rejuvenating Cream SPF 30
1383,Hope In A Jar
1384,Help Me
1385,Renewed Hope in A Jar Water Cream
1386,Turbo Booster C Powder
1387,Purity Made Simple Hydra-Bounce Eye Gel
1388,anti-wrinkle miracle worker eye+ line-correcting eye cream
1389,Fresh Cream Body Lotion
1390,anti-wrinkle miracle worker night+ line-correcting overnight cream
1391,Renewed Hope in a Jar Skin Tint
1392,Renewed Hope in A Jar Dew Facial Serum
1393,Pure Grace Nude Rose Body Lotion
1394,Amazing Grace Ballet Rose Firming Body Emulsion
1395,Time In A Bottle 100% In-Control
1396,Purity Made Simple Micellar Cleansing Water
1397,Renewed Hope in A Jar Eye Cream
1398,Ultimate Miracle Worker Eye Cream
1399,Ultimate Miracle Worker Fix Eye Power-Treatment
1400,Amazing Grace Satin-Finish Body Oil Mist
1401,Purity Made Simple Hydra-Essence with Coconut Water
1402,Purity Made Simple Micellar Cleansing Water Mini
1403,Ultimate Miracle Worker Fix Facial Serum Roller
1404,Take a Deep Breath Oil-Free Oxygenating Gel Cream
1405,Living Grace Firming Body Emulsion
1406,Pink Sugar Creamy Body Lotion
1407,Night Magic Intensive CBD Face Oil for Moisture & Radiance
1408,The Afterglow Deeply Restorative CBD Face Cream for Youthful Radiance
1409,Enlightenment Serum Concentrated CBD Serum Booster for Vital Hydration & Even Skin Toner
1410,Miracle Seed Essence
1411,Alpine Berry Water Cream
1412,Wild Seed Firming Serum
1413,Chamomile Micellar Cleansing Water
1414,Pure Brightening Serum
1415,Alpine Berry Water Oil-Free Gel Moisturizer
1416,7-Seed Nourishing Cleansing Oil
1417,Love the Earth Alpine Berry Water Cream
1418,Love the Earth Alpine Berry Water Toner
1419,Wild Seed Firming Eye Cream
1420,Gentle Comfort Hydrating Cream for Sensitive Skin
1421,Gentle Comfort Gel Cleanser for Sensitive Skin
1422,Rich Foaming Clarifying Cleanser
1423,Love the Earth Alpine Berry Water Oil-Free Gel
1424,Alpine Berry Water Toner
1425,Gentle Comfort Concentrate for Sensitive Skin
1426,Emergency Blemish Relief
1427,Advanced Dark Spot Correcting Serum
1428,Deep Cleansing Face Wash
1429,Blackhead Dissolving Gel
1430,Renewing Cleanser
1431,Pore Targeting Treatment
1432,Adapalene Gel 0.1% Acne Treatment
1433,Deep Cleansing Wash
1434,Green Tea Moisturizer
1435,Revitalizing Toner
1436,Complexion Perfecting Hydrator
1437,Repairing Treatment
1438,Daily Oil Control Moisturizer SPF 30
1439,Ready Steady Glow Daily AHA Toner
1440,Overnight Glow Dark Spot Sleeping Cream
1441,Evercalm Global Protection Day Cream
1442,Evercalm Overnight Recovery Balm
1443,Evercalm Gentle Cleansing Milk 
1444,ClearCalm Non-Drying Acne Treatment Gel
1445,ClearCalm 3 Clarifying Clay Cleanser
1446,Clean Screen Mattifying Face Sunscreen SPF 30
1447,Evercalm Anti-Redness Serum
1448,Bio Retinoid Anti-Wrinkle Concentrate Oil
1449,Glow Daily Vitamin C Gel Cream
1450,Keep Young and Beautiful Anti-Aging Eye Cream
1451,Keep Young And Beautiful Instant Firming Beauty Shot
1452,Flash Hydro-Boost Instant Plumping Emulsion
1453,V-Cense Revitalising Night Cream
1454,Rosa Centifolia No.1 Purity Cleansing Balm
1455,Bio Retinoid Anti-Ageing Cream
1456,Perfect Canvas Clean Jelly Oil Cleanser
1457,Keep Young And Beautiful Instant Brightening Beauty Shot Eye Lift
1458,Clarimatte T-Zone Control Cleansing Gel
1459,Rose O12 Moisture Defence Oil
1460,Flash Rinse 1 Minute Facial
1461,Vita-Mineral Daily Supplement Moisturising Cream
1462,Vita Mineral Active 7 Eye Gel 
1463,V-Cense Youth Vitality Day Cream
1464,Beauty Oil
1465,Luxury Face Oil- Jasmine & Neroli
1466,Luxury Face Cream
1467,Luxury Face Oil- Lavender Absolute
1468,Luxury Face Oil- Geranium & Orange Blossom
1469,Luxury CBD Beauty Serum
1470,Pore Clarifying Toner 10% Glycolic Acid + Pore Control Complex
1471,Freeze Frame Beauty Essence
1472,Wide Awake Brightening Eye Cream with Avocado
1473,Waterfall Glacier Water Cream
1474,Rise + Shine Gentle Cleanser
1475,Featherweight Daily Moisturizing Cream
1476,Bright Potion Probiotic Power Serum
1477,Daily Dew Hydrating Essence Mist
1478,Pretty Pop Probiotic Power Whipped Cream
1479,Multi-Purpose Oil
1480,Ultra Glow Serum: Glow + Strengthen Vitamin C Serum
1481,Brightening Eye Cream ?? Hydrate & Depuff
1482,Nourishing Moisturizer - Hydrate & Repair
1483,All Day Hydrator - Hydrate & Glow
1484,Super Matte Moisturizer
1485,Clean Skin Gel - Cleanse + Tone
1486,Firming Sleeping Cream
1487,Triple Action Cleansing Water
1488,Face Serum
1489,All-Over Solid Cleanser
1490,Firming Day Cream - Firm + Illuminate
1491,Oil-in-Foam Cleanser
1492,Clear Skin Days by Sephora Collection Clarifying Serum
1493,Moisturizing Body Milk - Surprise Flowers
1494,Clarifying Serum
1495,Gradual Self-Tanning Face Gel
1496,Clear Skin Days by Sephora Collection Clarifying Toner
1497,Triple Action Cleansing Water
1498,Retinol Reform®
1499,Weightless Oil-Free Moisturizer
1500,Texture Reform
1501,Sake Toning Essence
1502,Cleansing Serum
1503,Benefiance Wrinkle Smoothing Eye Cream
1504,Ultimate Sun Protector Lotion SPF 50+ Sunscreen
1505,Urban Environment Oil-Free UV Protector Broad Spectrum Face Sunscreen SPF 42
1506,Benefiance Wrinkle Smoothing Day Cream SPF 23
1507,Ultimune Power Infusing Serum Concentrate
1508,Bio-Performance Advanced Super Revitalizing Cream
1509,Benefiance Wrinkle Smoothing Cream Enriched
1510,White Lucent Brightening Cleansing Foam
1511,Benefiance NutriPerfect Night Cream
1512,Essential Energy Moisturizing Cream
1513,Essential Energy Moisturizing Gel Cream
1514,Bio-Performance Glow Revival Cream
1515,Clarifying Cleansing Foam
1516,Eudermine Revitalizing Essence 
1517,WASO: Color-Smart Day Moisturizer Oil-Free SPF 30 Sunscreen
1518,WASO: Clear Mega-Hydrating Moisturizer
1519,Benefiance Wrinkle Smoothing Cream
1520,WASO: Giga-Hydrating Rich Cream
1521,Deep Cleansing Foam
1522,White Lucent Anti-Dark Circles Eye Cream
1523,White Lucent Brightening Gel Cream
1524,Treatment Softener Enriched
1525,Future Solution LX Eye and Lip Contour Regenerating Cream
1526,Ultimate Sun Protector Cream SPF 50+ Face Sunscreen
1527,Future Solution LX Total Regenerating Cream
1528,Bio-Performance LiftDynamic Eye Treatment
1529,WASO: Eye Opening Essence
1530,Bio-Performance LiftDynamic Cream
1531,Future Solution LX Extra Rich Cleansing Foam
1532,White Lucent Overnight Cream & Mask
1533,Future Solution LX Total Protective Cream Broad Spectrum SPF 20 Sunscreen
1534,Complete Cleansing Microfoam
1535,Clear Stick UV Protector WetForce Broad Spectrum Sunscreen SPF 50+
1536,Perfect Cleansing Oil
1537,Future Solution LX Concentrated Balancing Softener
1538,Ultimune Eye Power Infusing Eye Concentrate
1539,WASO: Color-Smart Day Moisturizer SPF 30 Sunscreen
1540,Urban Environment UV Protection Cream Broad Spectrum SPF 40 For Face/Body
1541,Essential Energy Day Cream SPF 20
1542,White Lucent Day Emulsion Broad Spectrum SPF 23
1543,Future Solution LX Intensive Firming Contour Serum
1544,Bio-Performance Glow Revival Serum
1545,Extra Rich Cleansing Milk
1546,Ultimate Sun Protection Lotion Broad Spectrum SPF 50+ WetForce for Sensitive Skin & Children
1547,Treatment Softener
1548,WASO: Gentle Cleanser
1549,Future Solution LX Replenishing Treatment Oil
1550,WASO: Fresh Jelly Essence
1551,Future Solution LX Total Protective Emulsion Broad Spectrum SPF 20 Sunscreen
1552,Bio-Performance LiftDynamic Serum
1553,Bio Performance Glow Revival Eye Treatment
1554,Future Solution LX Universal Defense Broad Spectrum SPF 50+
1555,Essential Energy Eye Definer
1556,Future Solution LX Superior Radiance Serum
1557,White Lucent Illuminating Micro-Spot Serum
1558,Facial Treatment Essence (Pitera Essence)
1559,Facial Treatment Essence Mini (Pitera Essence)
1560,Facial Treatment Clear Lotion Toner
1561,R.N.A. POWER Anti-Aging Face Cream
1562,GenOptics Aura Essence Serum
1563,R.N.A. POWER Anti-Aging Eye Cream
1564,Facial Treatment Cleanser
1565,R.N.A. POWER Anti-Aging Essence Serum
1566,Ultimate Revival Cream
1567,GenOptics Spot Essence Serum
1568,Ultimate Revival Eye Cream
1569,Facial Treatment Cleansing Oil
1570,Ultimate Revival Essence
1571,Ultimate Revival Serum
1572,Licorice Serum CALM IRRITATED SKIN
1573,Essential Daily Moisturizer
1574,Gentle Foaming Face Wash
1575,Barrier+ Triple Lipid-Peptide Cream
1576,Barrier+ Triple Lipid-Boost 360° Eye Cream
1577,Barrier+ Foaming Oil Cleanser
1578,Eczema+ Dermatitis Face Balm
1579,Barrier+ Triple Lipid-Hyaluronate Serum
1580,Barrier+ Foaming Clay Cleanser
1581,Barrier+ Triple Lipid-Peptide Lotion
1582,Correct+ Dark Spot Corrector
1583,Redness Recovery+ Antioxidant Eye Treatment
1584,Barrier+ Nutrient Water Misting Tonic
1585,Bio Hyaluronic Moisturizing Cream
1586,4.5% Retinol Night Treatment
1587,Oligo Peptide Eye Cream
1588,35% Vitamin C Face Serum
1589,Plant Stem Cell Day Cream SPF 30
1590,15% Niacinamide Gel Serum
1591,27% Glycolic Acid Facial Cleanser
1592,My Sol Stick SPF 50
1593,EGF Activating Serum
1594,PSC Peptide Serum
1595,Hyaluronic Acid Hydrating Serum with Champaca Essence
1596,First Care Activating Serum
1597,Essential Firming Cream
1598,Gentle Cleansing Foam Hydrating Makeup Remover
1599,Gentle Cleansing Oil Makeup Remover
1600,First Care Activating Serum Limited Edition
1601,Bloomstay Vitalizing Eye Cream
1602,Essential Balancing Emulsion
1603,Essential Balancing Water
1604,Concentrated Ginseng Renewing Eye Cream
1605,Bloomstay Vitalizing Cream
1606,Concentrated Ginseng Renewing Cream
1607,Concentrated Ginseng Renewing Serum
1608,Bloomstay Vitalizing Serum
1609,Essential Refining Eye Cream
1610,Bloomstay Vitalizing Water
1611,First Care Activating Serum Mist
1612,Hydrating Micellar Gentle Cleansing Water
1613,Concentrated Ginseng Renewing Cream Light
1614,CC Me Vitamin C Serum
1615,Super Amino Gel Cleanser
1616,Good Genes All-In-One Lactic Acid Treatment
1617,C.E.O. 15% Vitamin C Brightening Serum
1618,Luna Retinol Sleeping Night Oil
1619,A+ High-Dose Retinol Serum
1620,U.F.O. Ultra-Clarifying Face Oil
1621,Tidal Brightening Enzyme Water Cream
1622,C.E.O Vitamin C Rich Hydration Cream
1623,C.E.O Glow Vitamin C + Turmeric Face Oil
1624,Juno Antioxidant + Superfood Face Oil
1625,C.E.O. Vitamin C Rich Hydration Cream
1626,Auto Correct Brightening and Depuffing Eye Contour Cream
1627,Saturn Sulfur Acne Treatment Mask
1628,ICE Ceramide Moisturizing Cream
1629,Ceramic Slip Cleanser
1630,C.E.O. Vitamin C + E Cleansing Oil
1631,Blue Moon Tranquility Cleansing Balm
1632,Martian Mattifying Melting Water-Gel Toner
1633,Unseen Sunscreen SPF 40
1634,Glowscreen Sunscreen SPF 40
1635,PLAY Everyday Lotion SPF 50 with Sunflower Extract
1636,Superscreen Daily Moisturizer Broad Spectrum SPF 40 PA+++
1637,Mattescreen Sunscreen SPF 40
1638,Glow Stick SPF 50
1639,Defense Refresh (Re)setting Mist SPF 40
1640,Bright-Eyed 100% Mineral Eye Cream SPF 40
1641,Zincscreen 100% Mineral Lotion SPF 40 PA+++
1642,City Sunscreen Serum SPF 30
1643,PLAY Everyday Lotion SPF 30 with Sunflower Extract
1644,Poof 100% Mineral Part and Scalp Powder SPF 45
1645,PLAY 100% Mineral Broad Spectrum Lotion SPF 50
1646,SEA drink of H2O hydrating boost moisturizer
1647,Knockout Tingle Treatment Toner
1648,Tarteguard Mineral Powder Sunscreen Broad Spectrum SPF 30
1649,Maracuja Oil
1650,Maracuja C-Brighter Eye Treatment
1651,SEA Deep Sea Collagen Super Serum
1652,SEA Deep Dive Cleansing Gel
1653,SEA Mermaid Skin Hyaluronic H2O Serum
1654,Baba Bomb Moisturizer
1655,SEA 4-in-1 Setting Mist
1656,knockout daily exfoliating cleanser
1657,SEA Set & Protect Mineral Sunscreen Powder Broad Spectrum SPF 30
1658,SEA FRXXXTION Stick Exfoliating Cleanser
1659,Youth or Dare Multi-Acid & C-Serum
1660,Tarteguard 30 Vegan Sunscreen Lotion Broad Spectrum SPF 30
1661,Cosmic Maracuja Concentrated Face Balm
1662,Regenerating Exfoliating Cleanser
1663,Clarifying Blemish & Oil Control Cleanser
1664,Restorative Anti-Aging Eye Cream
1665,Resurfacing AHA + BHA Serum
1666,Repairative Anti-Aging Moisturizer
1667,Hydrating Hyaluronic Acid Floral Essence
1668,Clarifying Moisturizer
1669,Retinoic Nutrient Face Oil With Vitamin A
1670,Rejuvenating Anti-Aging Serum
1671,Nourishing Makeup Removing Oil Cleanser
1672,Purifying Pore Detox Cleanser
1673,Crème Riche Anti-Aging Peptide Night Cream
1674,Boosted Contouring Retinol Eye Balm
1675,Concentrated Brightening Essence
1676,Hyaluronic Acid Gel Moisturizer
1677,Elixir Vitae Serum Wrinkle Solution
1678,Illuminating Anti-Aging Moisturizer
1679,Concentrated Brightening Serum
1680,Beautifying Brightening Face Oil with Vitamin C
1681,Elixir Vitae Eye Serum
1682,Illuminating Dark Circle Eye Cream
1683,Boosted Contouring Serum
1684,The Water Cream
1685,The Dewy Skin Cream
1686,The Water Cream: Limited Edition Value Size
1687,The Deep Cleanse Exfoliating Cleanser
1688,Violet-C Brightening Serum 20% Vitamin C + 10% AHA
1689,The Silk Peony Melting Eye Cream
1690,Pure One Step Camellia Oil Cleanser
1691,The Essence Plumping Skin Softener
1692,Silken Pore Perfecting Sunscreen Broad Spectrum SPF 35 PA+++
1693,Luminous Dewy Skin Mist
1694,Luminous Dewy Skin Night Concentrate
1695,The Silk Cream
1696,The Indigo Cream Soothing Skin Protectant
1697,The Pearl Tinted Eye Illuminating Treatment
1698,Luminous Deep Hydration Firming Serum
1699,The Serum Stick: Treatment & Touch Up Balm
1700,Luminous Deep Hydration Firming Eye Serum
1701,Gold Camellia Beauty Oil
1702,Soleil Blanc Mini Shimmering Body Oil
1703,Soleil Blanc Body Oil
1704,Oil-Free Daily Moisturizer
1705,Oud Wood Body Moisturizer
1706,Neroli Portofino Body Oil
1707,Skin Revitalizing Concentrate
1708,Intensive Purifying Mud Mask
1709,Neroli Portofino Body Moisturizer
1710,Hangover Good to Go Skin Protecting SPF 25 Moisturizer
1711,Hangover Good In Bed Ultra-Replenishing Hydrating Serum
1712,SOS Save.Our.Skin Daily Rescue Facial Spray
1713,SOS Save.Our.Skin Daily Rescue Facial Spray Mini
1714,Celery Green Cream with Hyaluronic Acid + Peptides
1715,Snow Mushroom Water Serum
1716,Hibiscus Unspottable?Correcting Oil
1717,Strawberry-C Brightening Serum
1718,Prismatic Luminizing Shield SPF 50
1719,Helix AM/PM Eye Gel
1720,Screen Time Hydrating Mist
1721,Oil-Control Mattifying Mist
1722,Eucalyptus Stretch Mark Minimizer
1723,Glow Getter Mist
1724,Hidden Glow Brightening Cream
1725,Superfood Antioxidant Cleanser
1726,Adaptogen Deep Moisture Cream with Ashwagandha + Reishi
1727,Superfood Air Whip Hyaluronic Acid Moisturizer
1728,Superberry Hydrate + Glow Oil
1729,Kombucha + 11% AHA Exfoliation Power Toner
1730,Superfood Firm and Brighten Vitamin C Serum
1731,Superfood Hydrate + Firm Peptide Eye Cream
1732,Adaptogen Soothe + Hydrate Activated Mist with Reishi + Ashwagandha
1733,Pure Shots Night Reboot Resurfacing Serum
1734,Pure Shots Perfect Plumper Face Cream
1735,Pure Shots Hydra Bounce Essence-In-Lotion
1736,Pure Shots Lines Away Anti-Aging Serum
1737,Pure Shots Light Up Brightening Serum
1738,Pure Shots Y Shape Firming Serum
1739,Pure Shots Night Reboot Resurfacing Serum Refill
1740,Pure Shots Perfect Plumper Face Cream Refill
1741,Pure Shots Lines Away Anti-Aging Serum Refill
1742,Pure Shots Light Up Brightening Serum Refill
1743,Pure Shots Y Shape Firming Serum Refill
1744,Clarifying Lotion
1745,Clear Skin Days by Sephora Collection Spot Eraser Stick
1746,Detoxifying Foam Cleanser Ghassoul Clay Extract
1747,Clear Skin Days by Sephora Collection Mattifying Booster Powder
1748,Illuminating Hydrator - Radiance + Smoothing
1749,Supreme Cleansing Oil
