id,name,new_name,brand,ingredientss
626,Skin Rescue Daily Face Cream
627,Skin Rescue Oil-Free Mattifying Gel Moisturizer
628,Ultra Repair Cream Cucumber Melon
629,Ultra Repair Cream Rosemary Mint
630,Eye Duty Triple Remedy Overnight Balm
631,Age Adapting CBD Serum
632,Soy Makeup Removing Face Wash
633,Rose & Hyaluronic Acid Deep Hydration Moisturizer 
634,Lotus Anti-Aging Night Moisturizer 
635,Rose & Hyaluronic Acid Deep Hydration Toner
636,Lotus Anti- Aging Daily Moisturizer 
637,Kombucha Antioxidant Facial Treatment Essence
638,Black Tea Firming and De-Puffing Eye Cream
639,Jumbo Rose & Hyaluronic Acid Deep Hydration Moisturizer
640,Sugar Strawberry Exfoliating Face Wash
641,Vitamin Nectar Glow Juice Antioxidant Face Serum
642,Black Tea Corset Cream Firming Moisturizer
643,Vitamin C Glow Moisturizer
644,Lotus Youth Preserve Eye Cream
645,Rose Floral Toner
646,Seaberry Moisturizing Face Oil
647,Vitamin Nectar Antioxidant Face Mist
648,Black Tea Age-Delay Cream
649,Rose Hydrating Eye Gel Cream
650,Kombucha Facial Treatment Essence NYC Limited Edition
651,Black Tea Age-Delay Firming Serum
652,Rose Cleansing Foam
653,Crème Ancienne® Soft Cream
654,Black Tea Firming Eye Serum
655,Soy Face Cleansing Milk
656,Seaberry Skin Nutrition Cleansing Oil
657,Crème Ancienne® Eye Cream
658,Lotus Eye Gel
659,Crème Ancienne Face Oil Elixir
660,Umbrian Clay Purifying Facial Toner
661,Lotus Youth Preserve Radiance Lotion
662,Peony Brightening Night Treatment Mask
663,Umbrian Clay Purifying Treatment Bar
664,Crème Ancienne®
665,Rose Hydrating Gel Cream
666,Crème Ancienne® Supreme Face Serum
667,Umbrian Clay Mattifying Serum
668,Moisturizing Hand Cream
669,Limited-Edition Black Tea Age-Delay Firming Serum
670,FreshFace Instant Glow Luminizer
671,Crème Ancienne® Infusion Toner
672,Crème Ancienne Supreme Eye Serum
673,Fresh Life Body Oil
674,GLOWSTARTER Mega Illuminating Moisturizer
675,BRIGHTEYES Illuminating Anti-Fatigue Eye Cream
676,SUPERTONER Exfoliating Acid Solution Toner
677,SUPERCLEANSE Clearing Cream-to-Foam Cleanser
678,Waterburst Hydrated Glow Moisturizer
679,Good in Bed Passionfruit Softening Night Cream
680,GENTLEBUBBLE  Daily Conditioning Cleanser
681,MOISTURETRIP Omega-Rich Face Moisturizer
682,SUPERSERUM 6-Acid Refining Treatment Serum
683,TROPICALCLEANSE Daily Exfoliating Cleanser
684,STARPOTION Liquid Charcoal Clarifying Oil
685,DREAMDUO Overnight Transforming Treatment
686,Watermelon Pink Juice Oil-Free Moisturizer
687,Banana Soufflé Moisture Cream
688,Pineapple-C Brightening Serum
689,Watermelon Glow Ultra-Fine Mist
690,Blueberry Bounce Gentle Cleanser
691,GOOPGLOW 20% Vitamin C and Hyaluronic Glow Serum
692,Bamboo Body Lotion
693,Abeille Royale Youth Watery Anti-Aging Oil
694,Abeille Royale Youth Watery Anti-Aging Oil Cherry Blossom Limited Edition
695,Abeille Royale Daily Repair Serum
696,Orchidée Impériale The Cream
697,Abeille Royale Double R Serum
698,Midnight Secret Late Night Recovery Treatment
699,Abeille Royale Night Cream
700,Orchidee Imperiale The Eye and Lip Contour Cream
701,Abeille Royale Anti-Aging Eye Cream
702,Abeille Royale Day Cream
703,Météorites Oxygen Care Moisturizer & Radiance Booster
704,Mon Guerlain Perfumed Body Lotion
705,Super Aqua-Serum
706,Orchidée Impériale The Gel Cream
707,Emerald CBD + Adaptogens Deep Moisture Glow Oil
708,Phoenix Cell Regenerating Facial Oil
709,Lapis Balancing Facial Oil
710,Pink Cloud Rosewater Moisture Crème
711,Emerald Hemp Seed Deep Moisture Glow Oil
712,Orchid Youth-Preserving Facial Oil
713,Prism 12% AHA + 3% BHA Exfoliating Glow Serum
714,Rose Hibiscus Hydrating Mist
715,Jasmine Green Tea Balancing Toner
716,Bamboo Charcoal Detoxifying Soap Bar
717,Moon Fruit Superfruit Night Treatment
718,Pink Clay Gentle Soap Bar
719,High Expectations Cannabis Seed Facial Oil
720,De-Puffing Under Eye Jade Roller
721,Salve The Day Multi Balm
722,Brightening Cleanser
723,CoQ-10 Toner
724,Squalane Facial Oil
725,I-Waken Eye Serum
726,Rosehip Cleanser
727,Banish Stick
728,Stem Cell Serum
729,Retinol Anti-Aging Serum
730,Hyaluronic Acid Hydrating Serum
731,Caffeine Eye Cream
732,Retinol Eye Cream
733,15% Vitamin C and EGF Brightening Serum
734,Brighten-i Eye Cream
735,Salicylic Acid Acne + Pore Cleanser
736,Peptide Moisturizer
737,Tranexamic Acid Hyperpigmentation Treatment
738,Collagen Booster Firming Peptide Serum
739,Glycolic Acid Exfoliating Toner
740,Q10 Antioxidant Serum
741,Beta Hydroxy Acid (BHA) Blemish + Blackhead Serum
742,Oat Cleansing Balm
743,"Vitamin B, C, and E Moisturizer"
744,Niacinamide Oil Control Serum
745,Bakuchiol Retinol Alternative Moisturizer
746,Ceramide Hydrating Night Treatment
747,Alpha Arbutin Brightening Serum
748,Polyglutamic Acid Hydrating Serum
749,Polyhydroxy Acid (PHA) Gentle Exfoliating Toner
750,Rosehip Nourishing Night Oil
751,Vitamin C Brightening Cream
752,Multi-Biotic Balancing Moisturizer 
753,Squalane Oil
754,Turmeric Brightening Moisturizer 
755,Snow Mushroom Hydrating Gel Moisturizer
756,Alpha Hydroxy Acid Serum
757,Lactic Acid Serum
758,Hepta-Peptide Anti-Aging Serum
759,Hemp Oil Moisturizer
760,Oil and Water Double Cleanser
761,Daily UV Defense Sunscreen SPF 36
762,Green Tea Seed Intensive Hydrating Serum
763,Green Tea Seed Intensive Hydrating Cream
764,Jeju Cherry Blossom Dewy Glow Jelly Cream
765,Volcanic Clusters Pore Clearing Toner
766,Volcanic Clusters Pore Clearing Facial Foam
767,Fermented Soybean Firming Energy Essence
768,Green Tea Hydrating Cleansing Foam
769,Green Tea Hydrating Cleansing Oil
770,Green Tea Seed Intensive Hydrating Eye Cream
771,Orchid Youth-Enriched Cream
772,Orchid Youth-Enriched Gel Cream
773,Green Tea Moisture-Balancing Toner
774,Orchid Youth-Enriched Eye Cream
775,Green Tea Seed Intensive Hydrating Toner
776,Green Tea Seed Intensive Hydrating Roll-On Eye Serum
777,Tangerine Brightening & Pore-Refining Serum
778,Green Barley Daily Refining Serum
779,Tangerine Brightening & Pore-Refining Cleanser
780,Green Tea Moisture-Balancing Cream
781,Cica Balm with Bija Seed Oil
782,Green Tea Moisture-Balancing Emulsion
783,Tangerine Brightening & Pore-Refining Moisturizer
784,Green Barley Refining Bubble Cleanser
785,Over It Magic Self-Tan Eraser
786,Confidence in a Cream Hydrating Moisturizer
787,Secret Sauce Anti-Aging Moisturizer
788,Bye Bye Under Eye Brightening Eye Cream
789,Confidence in Your Beauty Sleep
790,Bye Bye Redness Neutralizing Color-Correcting Cream
791,Confidence in a Cleanser
792,Miracle Water Micellar Cleanser
793,Confidence in a Gel Lotion
794,Bye Bye Pores Leave-On Solution Pore-Refining Toner
795,Bye Bye Makeup Cleansing Balm
796,Bye Bye Redness Sensitive Skin Moisturizer
797,Bye Bye Lines Anti-Aging Serum
798,Confidence in a Cream Hydrating Moisturizer Mini
799,Anti-Aging Armour Tinted Sunscreen SPF 50+
800,Confidence In A Cream Rosy Tone
801,Double-Duty Face Moisturizer Broad Spectrum SPF 20
802,Protein Booster Skin Serum
803,Clean Break Oil-Free Moisturizer
804,Protein Booster Eye Rescue
805,Cool Moisture Body Lotion
806,Oil-Free Sun Guard Sunscreen Water Resistant SPF 45
807,Eye Balm De-Puffing & Cooling Gel
808,Line Smoother Oil-Free Moisturizer
809,Power Peel Multi-Acid Resurfacing Pads
810,Dry Erase® Ultra-Calming Face Cream
811,Oil-Control Toner
812,Nectarine Blossom & Honey Body & Hand Lotion
813,English Pear & Freesia Body & Hand Lotion
814,Peony & Blush Suede Body Crème
815,Orange Blossom Body & Hand Lotion
816,Nectarine Blossom & Honey Body Crème
817,English Pear & Freesia Body Crème
818,Lime Basil & Mandarin Body & Hand Lotion
819,Wood Sage & Sea Salt Body Crème
820,Peony & Blush Suede Body & Hand Lotion
821,Mimosa & Cardamom Body Crème
822,Geranium & Walnut Hand Cream
823,Orange Blossom Body Crème
824,Lime Basil & Mandarin Body Crème
825,Blackberry & Bay Body & Hand Lotion
826,Red Roses Body Crème
827,Pomegranate Noir Body & Hand Lotion
828,Pomegranate Noir Body Crème
829,100 percent Pure Argan Oil
830,Whipped Argan Oil Face Butter
831,Argan Daily Moisturizer SPF 47 
832,Argan Beta Retinol Pink Algae Serum
833,100 percent Pure Argan Oil Light 
834,Argan Bright Skin Vitamin C Serum
835,Argan Daily Moisturizer Tinted SPF 47 Protect + Perfect
836,Pure Argan Milk Intensive Hydrating Treatment
837,Skin Dope Argan Oil + 100 mg CBD
838,Argan Cleansing Oil
839,Argan Infinity Cream Intensive Creamy Oil
840,Skin Dope Argan + Hemp Oil
841,Argan Smooth Skin Resurfacing Serum
842,Skin Dope 100mg CBD Recovery Face Moisturizer
843,Not A Hand Cream
844,ExfoliKate® Cleanser Daily Foaming Wash
845,EradiKate Acne Treatment
846,Kx Active Concentrates Ceramides + Omegas Serum
847,EradiKate® Daily Cleanser Acne Treatment
848,Anti Bac Clearing Lotion
849,Oil Free Moisturizer
850,Goat Milk Moisturizing Cream
851,Wrinkle Warrior 2-in-1 Plumping Moisturizer + Serum
852,ExfoliKate® Glow Moisturizer
853,Age Arrest Anti-Wrinkle Cream
854,D-Scar Scar Diminishing Serum
855,EradiKate® Salicylic Acid Acne Treatment
856,Goat Milk Moisturizing Cleanser
857,+Retinol Vita C Power Serum
858,Dry Skin Saver
859,+Retinol Vitamin C Moisturizer
860,EradiKate Mask Foam-Activated Acne Treatment
861,Retinol Firming Eye Cream
862,Line Release Under Eye Repair Cream
863,Gentle Daily Wash
864,Kx Active Concentrates Bio-Mimicking Peptides Serum
865,Quench Hydrating Face Serum
866,Peptide K8 Power Cream
867,Age Arrest Eye Cream
868,DermalQuench Liquid Lift + Retinol Advanced Resurfacing Treatment
869,Wrinkle Warrior® Eye Gel Visible Dark Circle Eraser
870,DermalQuench Liquid Lift Advanced Wrinkle Treatment 
871,Dermal Quench Wrinkle Warrior
872,Tight'N Cryogenic Tightening Gel
873,Purify Clarifying Cleanser
874,Daily Deflector Waterlight Broad Spectrum SPF 50+ PA+++ Anti-Aging Sunscreen
875,KateCeuticals Contouring Eye Serum
876,Moisturizing Skin Guardian
877,Bare Body Powder-Oil
878,Vital-Ice Cream
879,Lotus Caress to Moisturize Eyes
880,White Lotus Moisturizing Jelly
881,Ultra Facial Cream
882,Powerful-Strength Dark Circle Reducing Vitamin C Eye Serum
883,Creamy Eye Treatment with Avocado
884,Midnight Recovery Concentrate
885,Clearly Corrective Dark Spot Solution
886,Calendula Deep Clean Foaming Face Wash
887,Calendula Herbal Extract Alcohol Free Toner
888,Powerful-Strength Line-Reducing Concentrate 12.5% Vitamin C
889,Ultra Facial Cleanser
890,Facial Fuel Energizing Moisturizer for Men
891,Ultra Facial Oil-Free Gel-Cream
892,Super Multi-Corrective Cream
893,Ultra Facial Moisturizer SPF 30
894,Ultra Facial Toner
895,Rare Earth Deep Pore Daily Cleanser
896,Daily Reviving Concentrate
897,Super Fluid Daily UV Defense Sunscreen Broad Spectrum SPF 50+
898,Ultra Facial Overnight Hydrating Mask
899,Midnight Recovery Eye
900,Calendula Serum-Infused Water Cream
901,Cannabis Sativa Seed Oil Herbal Concentrate (Hemp-Derived) 
902,Hydro-Plumping Re-Texturizing Serum Concentrate
903,Ultra Facial Cream SPF 30
904,Age Defender Moisturizer
905,Ultra Facial Moisturizer
906,Blue Herbal Acne Cleanser Treatment
907,Midnight Recovery Botanical Cleansing Oil
908,Powerful Wrinkle Reducing Eye Cream
909,Powerful Wrinkle Reducing Cream Sunscreen Broad Spectrum SPF 30
910,Cucumber Herbal Conditioning Cleanser
911,Clearly Corrective Brightening and Smoothing Moisture Treatment
912,Super Multi-Corrective Cream Sunscreen Broad Spectrum SPF 30
913,Dermatologist Solutions Centella Sensitive Facial Cleanser
914,Clearly Corrective Brightening & Exfoliating Daily Cleanser
915,Cucumber Herbal Alcohol-Free Toner
916,Facial Fuel Sunscreen Broad Spectrum SPF 20
917,Facial Fuel Energizing Moisturizer for Men Mini
918,Eye Fuel
919,Rosa Arctica Lightweight Cream
920,Powerful Wrinkle Reducing Cream
921,Ultra Facial Oil-Free Toner
922,Youth Dose Eye Treatment
923,Ultra Facial Oil-Free Cleanser
924,Pure Vitality Skin Renewing Cream
925,Breakout Control Targeted Acne Spot Treatment
926,Blue Herbal Spot Treatment
927,Facial Fuel Energizing Tonic For Men
928,Glow Formula Skin Hydrator
929,Dermatologist Solutions Centella Sensitive Cica-Cream
930,Blue Astringent Herbal Lotion
931,Iris Extract Activating Treatment Essence
932,Age Defender Eye Repair
933,Precision Lifting & Pore-Tightening Concentrate
934,Breakout Control Acne Treatment Facial Lotion
935,Super Multi-Corrective Eye-Opening Serum
936,Age Defender Power Serum
937,Herbal-Infused Micellar Cleansing Water
938,Oil Eliminator 24-Hour Anti-Shine Moisturizer For Men
939,Super Fluid UV Mineral Defense Titanium Dioxide Sunscreen Broad Spectrum SPF 50+
940,"Cactus Flower & ""Tibetan Ginseng"" Hydrating Mist"
941,Rare Earth Pore Refining Tonic
942,Clearly Corrective Brightening & Soothing Treatment Water
943,Micro-Blur Skin Perfector
944,Oil Eliminator Refreshing Shine Control Toner For Men
945,Rosa Artica Youth Regenerating Cream
946,Ultra Facial Deep Moisture Balm
947,Blue Herbal Moisturizer
948,Coconut Rose Toner
949,Coconut Face Cream
950,Starry Eye Balm
951,Coconut Cleansing Oil
952,Save Face Oil
953,Coconut Sheer Oil
954,Sundaze Mineral Face Sunscreen SPF 30
955,Noni Glow Face Oil
956,Noni Bright Vitamin C Serum
957,Noni Radiant Eye Oil
958,Noni Night AHA Resurfacing Serum
959,Hydrating Moisturizer for Dry Skin
960,Gentle Cleanser for Sensitive Skin
961,Balancing Rose Mist
962,Cream Cleanser for Dry Skin
963,Noni Glow Face Balm
964,Greek Yoghurt Foaming Cream Cleanser
965,MenoReverse Volumizing Serum-in-Moisturizer
966,Greek Yoghurt Nourishing Probiotic Gel-Cream
967,Wild Rose Spotless Serum with 15% Vitamin Super C
968,"White Pine Meno-Reverse Deep Wrinkle, Plumping + Age Spot Concentrate"
969,Black Pine 3D Eye-Lift Super Serum
970,Black Pine Plump-Up Sleeping Facial
971,Black Pine Sculpt + Lift Serum
972,Greek Yoghurt Calming + Cooling Gel
973,Wild Rose Night-Brightening Sleeping Facial
974,Wild Rose Brightening Absolute Oil
975,Pomegranate Pore Blurring Gel Moisturizer
976,Ultra Rich Face Cream
977,Immortelle Divine Cream
978,Shea Light Comforting Cream
979,Divine Eyes
980,Aqua Reotier Ultra Thirst-Quenching Gel Moisturizer
981,Immortelle Overnight Reset Eye Serum
982,Aqua Reotier Ultra Thirst-Quenching Cream Moisturizer
983,Immortelle Reset Overnight Reset Oil-In Serum
984,Immortelle Precious Essential Face Mist
985,Immortelle Precious Eye Balm
986,Immortelle Precious Cream
987,Crème de la Mer Moisturizer
988,The Moisturizing Soft Cream
989,The Eye Concentrate
990,The Treatment Lotion
991,The Concentrate
992,The Cleansing Foam
993,The Moisturizing Cool Gel Cream
994,The Regenerating Serum
995,The Moisturizing Soft Lotion
996,The Eye Balm Intense
997,The Renewal Oil
998,The Revitalizing Hydrating Serum
999,The Lifting Eye Serum
1000,The Broad Spectrum SPF 50 UV Protecting Fluid
1001,The Tonic
1002,The Cleansing Gel
1003,The Cleansing Foam Mini
1004,The Cleansing Micellar Water
1005,The Moisturizing Matte Lotion
1006,The Cleansing Oil
1007,Age Rescue Eye Therapy
1008,Day Rescue Defense Lotion SPF 35
1009,All-In-One Face Treatment
1010,Age Rescue Water-Charged Gel Cream
1011,Future Rescue Repair Serum
1012,The Method: Nourish Normal-Combination Skin
1013,Advanced Retinol Treatment
1014,Eye Contour Lifting Cream with Diamond Powder
1015,The Method: Cleanse
1016,Omega Hydrating Oil
1017,Retexturizing Treatment Cream with Glycolic Acid 10x
1018,The Method: Nourish Oily-Congested Skin
1019,The Method: Cleanse Blemish Control
1020,Intensive Night Treatment with Hylaplex® and Marula Oil
1021,Younger® Pure Youth Serum with MIMIXYL
1022,Advanced C Radiance Cream with Vitamin C Collagen Cofactor 10x
1023,Soothe & Hydrate Serum with Hyaluronic Acid
1024,Dani Glowing Skin Perfector
1025,Sheer Fluid Sun Shield Broad Spectrum SPF 30 Sunscreen
1026,Advanced Génifique Youth Activating Serum
1027,Tonique Confort Re-Hydrating Comforting Toner with Acacia Honey
1028,UV Expert Aquagel Defense Primer & Moisturizer SPF 50
1029,Rénergie Lift Multi-Action Night Cream
1030,Bienfait Multi-Vital SPF 30 Day Cream Moisturizer
1031,Advanced Génifique Yeux Light-Pearl Eye Illuminator Youth Activating Concentrate
1032,Rénergie Lift Multi-Action Ultra Dark Spot Correcting Cream SPF 30
1033,"Bienfait Multi-Vital Night Cream, Highly Potent Overnight Face Moisturizer"
1034,Advanced Génifique Eye Cream
1035,Rénergie Lift Multi-Action Eye
1036,Hydra Zen Anti-Stress Gel Moisturizer
1037,Rénergie Lift Multi-Action Day Cream with SPF 15 - All Skin Types
1038,Crème Radiance Gentle Cleansing Creamy-Foam Cleanser
1039,Bienfait Multi-Vital Sunscreen Lotion Broad Spectrum SPF 30
1040,Visionnaire Advanced Skin Corrector Serum
1041,Renergie Lift Multi-Action Ultra Firming and Dark Spot Correcting Moisturizer SPF 30
1042,MOUSSE RADIANCE Clarifying Self-Foaming Cleanser
1043,Hydra Zen Anti-Stress Moisturizing Face Cream
1044,Visionnaire Advanced Multi-Correcting Cream
1045,Rénergie Lift Multi-Action Lifting and Firming Moisturizer Light Cream
1046,Tonique Douceur Softening Hydrating Toner with Rose Water
1047,Hydra Zen Anti-Stress Glow Liquid Moisturizer
1048,Visionnaire Nuit Beauty Sleep Perfector
1049,Rose Sugar Scrub
1050,Tonique Radiance Clarifying Refining Toner
1051,Advanced Génifique Sensitive Antioxidant Serum
1052,Rose Milk Re-Hydrating Mist
1053,Hydra Zen Anti-Stress Moisturizing Beauty Facial Essence
1054,"EAU FRACHE DOUCEUR Micellar Cleansing Water Face, Eyes, Lips"
1055,Visionnaire Skin Solutions 15% Pure Vitamin C Correcting Concentrate
1056,Visionnaire Skin Solutions Pure 0.2% Retinol Correcting Night Concentrate
1057,Bi-Facil Face Bi-Phased Micellar Water Face Makeup Remover & Cleanser
1058,Visionnaire Eye Cream Advanced Multi-Correcting Eye Balm
1059,Rènergie Lift Multi-Action Rich Cream with SPF 15 For Dry Skin
1060,La Vie Est Belle Body Lotion
1061,nergie de Vie The Illuminating & Anti-Fatigue Cooling Eye Gel
1062,Water Bank Moisture Cream
1063,Cream Skin Toner & Moisturizer
1064,Water Bank Hydro Gel
1065,Water Bank Hydro Essence
1066,Water Bank Eye Gel
1067,Essential Power Skin Toner for Normal to Dry Skin
1068,Multi Deep-Clean Cleanser
1069,Essential Power Skin Toner for Combination to Oily Skin
1070,Moisturizing Cream Cleanser
1071,Fresh Calming Toner
1072,Vitamin Brightening Cleansing Water
1073,Mini Pore Blur Perfector
1074,Fresh Calming Mousse Moisturizer
1075,Water Bank Dual Layer Face Oil
1076,Fresh Fig Soufflé Body Crème 
1077,Aglow Cleansing Butter
1078,Royal Oil 1000mg Pure CBD Oil
1079,Acid Mantle Repair Moisturizer With 250mg CBD and Ceramides
1080,sweat reset face moisturizer
1081,Crème du Nil Pore-Refining Moisture Veil
1082,Pure Nilotica Melt Nourishing Balm-to-Oil
1083,No.04 Bois de Balincourt Perfume Oil
1084,No.04 Bois de Balincourt Body Lotion
1085,No.09 Vallée de Farney Perfume Oil
1086,No.02 Le Long Fond Perfume Oil
1087,No.03 L'Etang Noir Perfume Oil
1088,No.10 Aboukir Perfume Oil
1089,No.05 Kandilli Perfume Oil
1090,No.04 Bois de Balincourt Body Oil
1091,Youthquake Hydra-full Retexturizing Gel Crème Moisturizer
1092,Youthquake Hydra-full Retexturizing Gel Crème Moisturizer Jumbo
1093,Mini Youthquake Hydra-full Retexturizing Gel Crème Moisturizer
1094,Drying Lotion
1095,"Facial Spray with Aloe, Herbs and Rosewater"
1096,"Facial Spray with Aloe, Cucumber and Green Tea"
1097,Glycolic Acid Toner
1098,Vitamin C Serum
1099,"Facial Spray with Aloe, Chamomile and Lavender"
1100,Acne Facial Cleanser
1101,Seaweed Night Cream
1102,Enzyme Cleansing Gel
1103,Hyaluronic Eye Cream
1104,Glycolic Foaming Cleanser
1105,Oil Free Moisturizer Broad Spectrum SPF 30
1106,Facial Spray with Aloe Sage & Orange Blossom
1107,Buffering Lotion
1108,Silver Powder
1109,Cucumber Cleansing Lotion
1110,Special Cucumber Lotion
1111,Herbal Hydrating Serum
1112,Cellufirm Drops
1113,Mineral Crème Broad Spectrum SPF 50 UVA-UVB Sunscreen
1114,Michael Kors Body Crème
1115,Vegan Milk Moisturizer
1116,Cooling Water
1117,Melatonin Overnight Serum
1118,Vegan Milk Cleanser
1119,Vegan Milk Moisturizer Mini
1120,Cooling Water Mini
1121,Watermelon Brightening Serum
1122,Matcha Toner
1123,Hydrating Oil Stick
1124,Matcha Cleanser
1125,Sunshine Oil
1126,MIU MIU Body Lotion
1127,Plump Jelly Hyaluronic Serum
1128,Cosmic Cream Collagen Protecting Moisturizer
1129,Milk Cleanse Gentle Foaming Cleanser
1130,Holy Yoni Adaptogenic Oil
1131,Essential-C Day Moisture Broad Spectrum SPF 30 PA+++
1132,Rapid Age Spot and Pigment Lightening Serum 
1133,Vitamin C Dark Circle Correcting Eye Serum
1134,Clarifying Cleanser
1135,AHA/BHA Exfoliating Cleanser
1136,Retinol Youth Renewal Serum
1137,Retinol Youth Renewal Night Cream
1138,Rapid Relief Acne Spot Treatment
1139,Advanced Active Radiance® Serum
1140,Time Release Acne Cleanser
1141,InvisiScar Resurfacing Treatment
1142,Nutrient-Charged Water Gel
1143,Essential-C Cleanser
1144,Oil and Pore Control Mattifier Broad Spectrum SPF 45 PA++++
1145,Hydro-Dynamic® Ultimate Moisture
1146,Vitamin C Glycolic Brightening Serum
1147,Post-Acne Spot Lightening Gel
1148,Skin Perfecting Lotion - Blemish Prone/Oily Skin
1149,Anti-Aging Moisturizer SPF 30 PA+++
1150,Renewing Eye Cream
1151,Clarifying Body Spray
1152,Outsmart Acne Clarifying Treatment
1153,Essential-C Toner
1154,Clarifying Toner
1155,Resurgence® Age??Balancing Moisture Broad Spectrum SPF 30
1156,Renewing Cleansing Cream
1157,Rapid Collagen Infusion
1158,Advanced Acne & Wrinkle Reducer
1159,Revitalixir Recovery Serum
1160,Night Fix Enzyme Treatment
1161,Multi-Vitamin Infusion Oil
1162,Essential-C Eye Cream SPF 15 PA++
1163,City Skin Overnight Detox Moisturizer
1164,Prebiotic 4-in-1 MultiCleanser
1165,Resurgence Age-Balancing Night Cream
1166,Hydrating Toner
1167,Refreshing Cleanser
1168,Hydro-Dynamic® Ultimate Moisture For Eyes
1169,Hydro-Dynamic® Quenching Essence
1170,Prebiotic 3-in-1 MultiMist
1171,MattEffect Blotting Perfector
1172,Retinol Youth Renewal Eye Serum
1173,City Skin Age Defense Broad Spectrum SPF 50 PA++++
1174,After-Dark Natural Peptide Sleeping Cream
1175,Major Moisture Gentle Cream Cleanser
1176,Skin Warrior Anti-Pollution Repair Cream
1177,Supercharge Anti-Oxidant Moisture Serum
1178,Illumi-Nation Anti-Fatigue Power Serum
1179,Zero Baggage Anti-Dark Circle Eye Cream
1180,Mineral Sun Defense Moisturizer Broad Spectrum Sunscreen SPF 30
1181,Citrine Body Cream
1182,Gel Primer 24K Gold Complex - Firm
1183,Vitamin C+ Arbutin Brightening Serum
1184,Retinol 0.5 Retexturizing Cream
1185,Vitamin C Eye Brightener
1186,Kinetin+ Hydrating Cream
1187,Kinetin+ Hydrating Eye Cream
1188,Kinetin+ Rejuvenating Serum
1189,Vitamin C Suncare Broad Spectrum SPF 30 Sunscreen
1190,Banana Bright Eye Crème
1191,Truth Serum®
1192,Banana Bright Vitamin C Serum
1193,C-Rush Vitamin C Gel Moisturizer
1194,Glow2OH Dark Spot Toner
1195,Balancing Force Oil Control Toner
1196,Sheer Transformation® Perfecting Moisturizer
1197,The Clean Truth Foaming Cleanser
1198,Goodnight Glow Retin-ALT Sleeping Crème
1199,Truth Juice Daily Cleanser
1200,Find Your Balance Oil Control Cleanser
1201,Counter Balance Oil Control Hydrator
1202,Glow Cycle Retin-ALT Power Serum
1203,Invigorating Night Transformation Gel
1204,C-Rush Brightening Double Crème
1205,Nurture Me Moisturizing Crème
1206,Acid Fix AHA BHA Treatment
1207,Queen of Hungary Mist
1208,Cleansing Foam
1209,Illuminating Moisturiser
1210,Balancing Moisturiser
1211,Thermal Cleansing Balm
1212,Rejuvenating Night Cream
1213,Moor Cream Cleanser
1214,Reviving Eye Cream
1215,Daily Vitamin C
1216,Miracle Facial Oil
1217,Niacinamide 10% + Zinc 1%
1218,Hyaluronic Acid 2% + B5
1219,Glycolic Acid 7% Toning Solution
1220,"""Buffet"""
1221,The No-Brainer Set
1222,100% Organic Cold-Pressed Rose Hip Seed Oil
1223,Caffeine Solution 5% + EGCG
1224,Natural Moisturizing Factors + HA
1225,Lactic Acid 10% + HA
1226,Alpha Arbutin 2% + HA
1227,"""Buffet"" + Copper Peptides 1%"
1228,Azelaic Acid Suspension 10%
1229,Retinol 0.5% in Squalane
1230,100% Plant-Derived Squalane
1231,Ascorbic Acid 8% + Alpha Arbutin 2%
1232,Vitamin C Suspension 23% + HA Spheres 2%
1233,Lactic Acid 5% + HA
1234,Ascorbyl Glucoside Solution 12%
1235,Vitamin C Suspension 30% in Silicone
1236,100% Plant-Derived Hemi-Squalane
1237,100% Organic Cold-Pressed Moroccan Argan Oil
1238,Matrixyl* 10% + HA
1239,Ascorbyl Tetraisopalmitate Solution 20% in Vitamin F
1240,Amino Acids + B5
1241,Marine Hyaluronics
1242,"""B"" Oil"
1243,Pycnogenol 5%
1244,Ethylated Ascorbic Acid 15% Solution
1245,Argireline Solution 10%
1246,EUK 134 0.1%
1247,Retinol 0.2% in Squalane
1248,Mandelic Acid 10% + HA
1249,100% Organic Virgin Chia Seed Oil
1250,100% L-Ascorbic Acid Powder
1251,Magnesium Ascorbyl Phosphate 10%
1252,Granactive Retinoid* 2% Emulsion
1253,Resveratrol 3% + Ferulic Acid 3%
1254,GinZing Refreshing Eye Cream to Brighten and Depuff
1255,Checks and Balances Frothy Face Wash
1256,GinZing Oil- Free Energy Boosting Gel Moisturizer
1257,A Perfect World SPF 40 Age-Defense Moisturizer with White Tea
1258,High-Potency Night-a-Mins Resurfacing Cream with Fruit-Derived AHAs
1259,Dr. Andrew Weil For Origins Mega-Mushroom Relief & Resilience Soothing Treatment Lotion
1260,Original Skin Matte Moisturizer with Willowherb
1261,Plantscription SPF 25 Power Anti-Aging Cream
1262,Super Spot Remover Acne Treatment Gel
1263,GinZing SPF 40 Energy-Boosting Tinted Moisturizer
1264,High-Potency Night-a-Mins Oil-Free Resurfacing Cream with Fruit-Derived AHAs
1265,Plantscription Anti-Aging Power Serum
1266,Eye Doctor Moisture Care For Skin Around Eyes
1267,Clear Improvement Pore Clearing Moisturizer with Salicylic Acid
1268,Dr. Andrew Weil For Origins Mega-Mushroom Relief & Resilience Soothing Treatment Lotion Limited Edition
1269,Plantscription Anti-Aging Cleanser
1270,Dr. Andrew Weil For Origins Mega-Mushroom Relief & Resilience Advanced Face Serum
1271,Zero Oil Pore Purifying Toner
1272,GinZing Ultra-Hydrating Energy-Boosting Cream
1273,Plantscription SPF 25 Power Anti-Aging Oil-Free Cream
1274,Peace Of Mind On-the-Spot Relief
1275,Plantscription Anti-Aging Power Eye Cream
1276,United State Balancing Tonic
1277,Plantscription Powerful Lifting Cream
1278,A Perfect World Age-Defense Treatment Lotion with White Tea
1279,Plantscription Retinol Night Moisturizer
